{
  "schema_version": "0.2",
  "graph": {
    "nodes": [
      {
        "id": "sensory:fur",
        "label": "fur",
        "kind": "sensory",
        "organ": "perception"
      },
      {
        "id": "sensory:meow",
        "label": "meow",
        "kind": "sensory",
        "organ": "perception"
      },
      {
        "id": "sensory:purr",
        "label": "purr",
        "kind": "sensory",
        "organ": "perception"
      },
      {
        "id": "sensory:bark",
        "label": "bark",
        "kind": "sensory",
        "organ": "perception"
      },
      {
        "id": "sensory:tail_wag",
        "label": "tail_wag",
        "kind": "sensory",
        "organ": "perception"
      },
      {
        "id": "sensory:motionless",
        "label": "motionless",
        "kind": "sensory",
        "organ": "perception"
      },
      {
        "id": "sensory:plastic_seam",
        "label": "plastic_seam",
        "kind": "sensory",
        "organ": "perception"
      },
      {
        "id": "sensory:warm_body",
        "label": "warm_body",
        "kind": "sensory",
        "organ": "perception"
      },
      {
        "id": "sensory:four_legs",
        "label": "four_legs",
        "kind": "sensory",
        "organ": "perception"
      },
      {
        "id": "sensory:whiskers",
        "label": "whiskers",
        "kind": "sensory",
        "organ": "perception"
      },
      {
        "id": "sensory:collar",
        "label": "collar",
        "kind": "sensory",
        "organ": "perception"
      },
      {
        "id": "hypothesis:cat",
        "label": "cat",
        "kind": "hypothesis",
        "organ": "hypothesis"
      },
      {
        "id": "hypothesis:dog",
        "label": "dog",
        "kind": "hypothesis",
        "organ": "hypothesis"
      },
      {
        "id": "hypothesis:toy",
        "label": "toy",
        "kind": "hypothesis",
        "organ": "hypothesis"
      },
      {
        "id": "memory:workspace",
        "label": "working memory",
        "kind": "memory",
        "organ": "memory"
      },
      {
        "id": "action:report",
        "label": "report belief",
        "kind": "action",
        "organ": "action"
      }
    ],
    "edges": [
      {
        "source": "sensory:fur",
        "target": "hypothesis:cat",
        "weight": 0.48,
        "plastic": false,
        "label": "evidence"
      },
      {
        "source": "sensory:fur",
        "target": "hypothesis:dog",
        "weight": 0.38,
        "plastic": false,
        "label": "evidence"
      },
      {
        "source": "sensory:fur",
        "target": "hypothesis:toy",
        "weight": 0.06,
        "plastic": false,
        "label": "evidence"
      },
      {
        "source": "sensory:meow",
        "target": "hypothesis:cat",
        "weight": 0.82,
        "plastic": false,
        "label": "evidence"
      },
      {
        "source": "sensory:meow",
        "target": "hypothesis:dog",
        "weight": -0.18,
        "plastic": false,
        "label": "evidence"
      },
      {
        "source": "sensory:meow",
        "target": "hypothesis:toy",
        "weight": -0.05,
        "plastic": false,
        "label": "evidence"
      },
      {
        "source": "sensory:purr",
        "target": "hypothesis:cat",
        "weight": 0.78,
        "plastic": false,
        "label": "evidence"
      },
      {
        "source": "sensory:purr",
        "target": "hypothesis:dog",
        "weight": -0.12,
        "plastic": false,
        "label": "evidence"
      },
      {
        "source": "sensory:purr",
        "target": "hypothesis:toy",
        "weight": -0.05,
        "plastic": false,
        "label": "evidence"
      },
      {
        "source": "sensory:bark",
        "target": "hypothesis:dog",
        "weight": 0.85,
        "plastic": false,
        "label": "evidence"
      },
      {
        "source": "sensory:bark",
        "target": "hypothesis:cat",
        "weight": -0.18,
        "plastic": false,
        "label": "evidence"
      },
      {
        "source": "sensory:bark",
        "target": "hypothesis:toy",
        "weight": -0.05,
        "plastic": false,
        "label": "evidence"
      },
      {
        "source": "sensory:tail_wag",
        "target": "hypothesis:dog",
        "weight": 0.55,
        "plastic": false,
        "label": "evidence"
      },
      {
        "source": "sensory:tail_wag",
        "target": "hypothesis:cat",
        "weight": 0.1,
        "plastic": false,
        "label": "evidence"
      },
      {
        "source": "sensory:tail_wag",
        "target": "hypothesis:toy",
        "weight": 0.0,
        "plastic": false,
        "label": "evidence"
      },
      {
        "source": "sensory:motionless",
        "target": "hypothesis:toy",
        "weight": 0.66,
        "plastic": false,
        "label": "evidence"
      },
      {
        "source": "sensory:motionless",
        "target": "hypothesis:cat",
        "weight": -0.22,
        "plastic": false,
        "label": "evidence"
      },
      {
        "source": "sensory:motionless",
        "target": "hypothesis:dog",
        "weight": -0.22,
        "plastic": false,
        "label": "evidence"
      },
      {
        "source": "sensory:plastic_seam",
        "target": "hypothesis:toy",
        "weight": 0.92,
        "plastic": false,
        "label": "evidence"
      },
      {
        "source": "sensory:plastic_seam",
        "target": "hypothesis:cat",
        "weight": -0.15,
        "plastic": false,
        "label": "evidence"
      },
      {
        "source": "sensory:plastic_seam",
        "target": "hypothesis:dog",
        "weight": -0.15,
        "plastic": false,
        "label": "evidence"
      },
      {
        "source": "sensory:warm_body",
        "target": "hypothesis:cat",
        "weight": 0.25,
        "plastic": false,
        "label": "evidence"
      },
      {
        "source": "sensory:warm_body",
        "target": "hypothesis:dog",
        "weight": 0.25,
        "plastic": false,
        "label": "evidence"
      },
      {
        "source": "sensory:warm_body",
        "target": "hypothesis:toy",
        "weight": -0.45,
        "plastic": false,
        "label": "evidence"
      },
      {
        "source": "sensory:four_legs",
        "target": "hypothesis:cat",
        "weight": 0.25,
        "plastic": false,
        "label": "evidence"
      },
      {
        "source": "sensory:four_legs",
        "target": "hypothesis:dog",
        "weight": 0.28,
        "plastic": false,
        "label": "evidence"
      },
      {
        "source": "sensory:four_legs",
        "target": "hypothesis:toy",
        "weight": 0.05,
        "plastic": false,
        "label": "evidence"
      },
      {
        "source": "sensory:whiskers",
        "target": "hypothesis:cat",
        "weight": 0.64,
        "plastic": false,
        "label": "evidence"
      },
      {
        "source": "sensory:whiskers",
        "target": "hypothesis:dog",
        "weight": -0.08,
        "plastic": false,
        "label": "evidence"
      },
      {
        "source": "sensory:whiskers",
        "target": "hypothesis:toy",
        "weight": 0.02,
        "plastic": false,
        "label": "evidence"
      },
      {
        "source": "sensory:collar",
        "target": "hypothesis:dog",
        "weight": 0.36,
        "plastic": false,
        "label": "evidence"
      },
      {
        "source": "sensory:collar",
        "target": "hypothesis:cat",
        "weight": 0.18,
        "plastic": false,
        "label": "evidence"
      },
      {
        "source": "sensory:collar",
        "target": "hypothesis:toy",
        "weight": 0.02,
        "plastic": false,
        "label": "evidence"
      },
      {
        "source": "hypothesis:cat",
        "target": "hypothesis:dog",
        "weight": -0.16,
        "plastic": false,
        "label": "lateral_inhibition"
      },
      {
        "source": "hypothesis:cat",
        "target": "hypothesis:toy",
        "weight": -0.16,
        "plastic": false,
        "label": "lateral_inhibition"
      },
      {
        "source": "hypothesis:dog",
        "target": "hypothesis:cat",
        "weight": -0.16,
        "plastic": false,
        "label": "lateral_inhibition"
      },
      {
        "source": "hypothesis:dog",
        "target": "hypothesis:toy",
        "weight": -0.16,
        "plastic": false,
        "label": "lateral_inhibition"
      },
      {
        "source": "hypothesis:toy",
        "target": "hypothesis:cat",
        "weight": -0.16,
        "plastic": false,
        "label": "lateral_inhibition"
      },
      {
        "source": "hypothesis:toy",
        "target": "hypothesis:dog",
        "weight": -0.16,
        "plastic": false,
        "label": "lateral_inhibition"
      }
    ]
  },
  "frames": [
    {
      "time": 1.01,
      "external_event": "fur",
      "truth": "cat",
      "prediction": null,
      "sparks": [
        {
          "id": "sensory:fur",
          "label": "fur",
          "kind": "sensory",
          "organ": "perception",
          "activation": 0.048901,
          "threshold": 0.564985,
          "fired_count": 1,
          "last_fire": 1.0
        },
        {
          "id": "sensory:meow",
          "label": "meow",
          "kind": "sensory",
          "organ": "perception",
          "activation": 0.0,
          "threshold": 0.55,
          "fired_count": 0,
          "last_fire": null
        },
        {
          "id": "sensory:purr",
          "label": "purr",
          "kind": "sensory",
          "organ": "perception",
          "activation": 0.0,
          "threshold": 0.55,
          "fired_count": 0,
          "last_fire": null
        },
        {
          "id": "sensory:bark",
          "label": "bark",
          "kind": "sensory",
          "organ": "perception",
          "activation": 0.0,
          "threshold": 0.55,
          "fired_count": 0,